{
  "schema_version": "0.1",
  "kind": "corpus_loop_v1_manifest",
  "loop_id": "watson-cyc-semantic-web-chronos-v1",
  "source_corpus": "SocioProphet/sociosphere#334",
  "resolution_mode": "pinned_declared",
  "components": [
    {
      "plane": "evidence",
      "repo": "SocioProphet/sherlock-search",
      "issue_ref": "SocioProphet/sherlock-search#56",
      "merged_ref": "SocioProphet/sherlock-search#58",
      "pinned_commit": "fca062b9302d24be58cbea55885720b2e143b276",
      "artifact_refs": [
        "schemas/source-quality-answer-trace.v0.schema.json",
        "fixtures/source-quality-answer-trace/valid.confirmed-bibliographic.json",
        "tools/validate_source_quality_answer_trace.py"
      ]
    },
    {
      "plane": "ontology",
      "repo": "SocioProphet/ontogenesis",
      "issue_ref": "SocioProphet/ontogenesis#89",
      "merged_ref": "SocioProphet/ontogenesis#103",
      "pinned_commit": "b67f458fe8f19fa37505784e4e072c7b954a04dd",
      "artifact_refs": [
        "Platform/corpus-event-semantics.ttl",
        "shapes/corpus-event-semantics.shacl.ttl",
        "scripts/validate_corpus_event_semantics.py"
      ]
    },
    {
      "plane": "policy",
      "repo": "SocioProphet/policy-fabric",
      "issue_ref": "SocioProphet/policy-fabric#78",
      "merged_ref": "SocioProphet/policy-fabric#85",
      "pinned_commit": "90b08a76c0c6e6c0216eefe2591990081714c559",
      "artifact_refs": [
        "contracts/governed-action-policy-decision.v0.schema.json",
        "examples/governed-action-policy/valid.low-risk-allow.json",
        "tools/validate_governed_action_policy_decision.py"
      ]
    },
    {
      "plane": "runtime",
      "repo": "SocioProphet/agentplane",
      "issue_ref": "SocioProphet/agentplane#162",
      "merged_ref": "SocioProphet/agentplane#184",
      "pinned_commit": "480fcb7ce4dfca124f6b893306348b76b9103938",
      "artifact_refs": [
        "schemas/bounded-action-loop.v0.schema.json",
        "tests/fixtures/bounded-action-loop/valid.record-event-instance.json",
        "tools/check_bounded_action_loop.py"
      ]
    },
    {
      "plane": "ledger",
      "repo": "SocioProphet/model-governance-ledger",
      "issue_ref": "SocioProphet/model-governance-ledger#19",
      "merged_ref": "SocioProphet/model-governance-ledger#20",
      "pinned_commit": "9be3fdba36e8783eca3fb596f6a4ff9cddcc60d0",
      "artifact_refs": [
        "schemas/governance-audit-record.v0.schema.json",
        "examples/governance-audit-record.valid.json",
        "tools/check_record_v0.py"
      ]
    }
  ],
  "sociosphere_boundary": {
    "owns_coordination": true,
    "owns_downstream_implementation": false
  }
}
